{
  "schema_version": "1.2.0",
  "id": "CHK-20260901-4B80A6B3",
  "kind": "checkpoint",
  "session_id": "ahp-1.3-development",
  "project_id": "ahp-plus",
  "summary": "Implemented and locally validated the AHP+ 1.3 intent CLI and IDE-chat message surface",
  "objective": "Publish AHP+ 1.2 through next, consumer validation, and explicit stable promotion",
  "next_action": "Design the authenticated relay envelope, receipt, replay, and reconnect contract",
  "files": [
    "src/command-catalog.mjs",
    "src/cli.mjs",
    "src/events.mjs",
    "templates/adapters",
    "docs/COMMANDS.md"
  ],
  "validations": [
    "QA-20260901-A77312D5"
  ],
  "blockers": [],
  "actor": {
    "name": "Codex",
    "platform": "codex",
    "model": "unknown"
  },
  "git": {
    "branch": "codex/v1.3-realtime-messaging",
    "commit": "7ae8987e9fbb7aba6d6f36584bfcdb7c57b22196",
    "tree": "8300ce82ba11f6a802e631eb6eee806b363546dd",
    "working_tree": "DIRTY",
    "changed_files": [
      {
        "code": " M",
        "path": "README.es.md"
      },
      {
        "code": " M",
        "path": "README.md"
      },
      {
        "code": " M",
        "path": "SPECIFICATION.md"
      },
      {
        "code": " M",
        "path": "VERSION"
      },
      {
        "code": " M",
        "path": "docs/CHANNELS_ES.md"
      },
      {
        "code": " M",
        "path": "docs/COMMANDS.md"
      },
      {
        "code": " M",
        "path": "docs/COMMANDS_BY_SURFACE_ES.md"
      },
      {
        "code": " M",
        "path": "docs/CONFORMANCE.md"
      },
      {
        "code": " M",
        "path": "docs/CONTINUITY_EVENTS.md"
      },
      {
        "code": " M",
        "path": "package.json"
      },
      {
        "code": " M",
        "path": "src/cli.mjs"
      },
      {
        "code": " M",
        "path": "src/constants.mjs"
      },
      {
        "code": " M",
        "path": "src/events.mjs"
      },
      {
        "code": " M",
        "path": "templates/adapters/chatgpt/AHP_MOBILE.md"
      },
      {
        "code": " M",
        "path": "templates/adapters/claude/CLAUDE.fragment.md"
      },
      {
        "code": " M",
        "path": "templates/adapters/codex/.agents/skills/ahp/SKILL.md"
      },
      {
        "code": " M",
        "path": "templates/adapters/codex/.agents/skills/ahp/agents/openai.yaml"
      },
      {
        "code": " M",
        "path": "templates/adapters/cursor/ahp.md"
      },
      {
        "code": " M",
        "path": "templates/adapters/generic/AGENTS.fragment.md"
      },
      {
        "code": " M",
        "path": "templates/adapters/generic/AHP_INSTRUCTIONS.md"
      },
      {
        "code": " M",
        "path": "templates/adapters/opencode/ahp.md"
      },
      {
        "code": " M",
        "path": "tests/core.test.mjs"
      },
      {
        "code": "??",
        "path": ".ahp/events/ahp-1.3-development/EVT-20260901-C1BE17A5.json"
      },
      {
        "code": "??",
        "path": ".ahp/evidence/EVD-20260901-CC90E7D9.json"
      },
      {
        "code": "??",
        "path": ".ahp/evidence/EVD-20260901-D4587A05.json"
      },
      {
        "code": "??",
        "path": ".ahp/records/decisions/DEC-20260901-974AB018.json"
      },
      {
        "code": "??",
        "path": ".ahp/records/qa/QA-20260901-A77312D5.json"
      },
      {
        "code": "??",
        "path": ".ahp/records/requirements/REQ-20260901-8A668347.json"
      },
      {
        "code": "??",
        "path": "src/command-catalog.mjs"
      }
    ],
    "working_tree_digest": "a0d3874e4ec2c1d2487a9dcc824c4939de5982506c0dd8bfbab8b72b7f471812",
    "project_working_tree": "DIRTY",
    "project_changed_files": [
      {
        "code": " M",
        "path": "README.es.md"
      },
      {
        "code": " M",
        "path": "README.md"
      },
      {
        "code": " M",
        "path": "SPECIFICATION.md"
      },
      {
        "code": " M",
        "path": "VERSION"
      },
      {
        "code": " M",
        "path": "docs/CHANNELS_ES.md"
      },
      {
        "code": " M",
        "path": "docs/COMMANDS.md"
      },
      {
        "code": " M",
        "path": "docs/COMMANDS_BY_SURFACE_ES.md"
      },
      {
        "code": " M",
        "path": "docs/CONFORMANCE.md"
      },
      {
        "code": " M",
        "path": "docs/CONTINUITY_EVENTS.md"
      },
      {
        "code": " M",
        "path": "package.json"
      },
      {
        "code": " M",
        "path": "src/cli.mjs"
      },
      {
        "code": " M",
        "path": "src/constants.mjs"
      },
      {
        "code": " M",
        "path": "src/events.mjs"
      },
      {
        "code": " M",
        "path": "templates/adapters/chatgpt/AHP_MOBILE.md"
      },
      {
        "code": " M",
        "path": "templates/adapters/claude/CLAUDE.fragment.md"
      },
      {
        "code": " M",
        "path": "templates/adapters/codex/.agents/skills/ahp/SKILL.md"
      },
      {
        "code": " M",
        "path": "templates/adapters/codex/.agents/skills/ahp/agents/openai.yaml"
      },
      {
        "code": " M",
        "path": "templates/adapters/cursor/ahp.md"
      },
      {
        "code": " M",
        "path": "templates/adapters/generic/AGENTS.fragment.md"
      },
      {
        "code": " M",
        "path": "templates/adapters/generic/AHP_INSTRUCTIONS.md"
      },
      {
        "code": " M",
        "path": "templates/adapters/opencode/ahp.md"
      },
      {
        "code": " M",
        "path": "tests/core.test.mjs"
      },
      {
        "code": "??",
        "path": "src/command-catalog.mjs"
      }
    ],
    "project_working_tree_digest": "0451e38ded81aa6b3fd04838f5da5f0a802ad80b9ec7e8faf4fe0759822892df",
    "ahp_state_working_tree": "DIRTY",
    "ahp_state_changed_files": [
      {
        "code": "??",
        "path": ".ahp/events/ahp-1.3-development/EVT-20260901-C1BE17A5.json"
      },
      {
        "code": "??",
        "path": ".ahp/evidence/EVD-20260901-CC90E7D9.json"
      },
      {
        "code": "??",
        "path": ".ahp/evidence/EVD-20260901-D4587A05.json"
      },
      {
        "code": "??",
        "path": ".ahp/records/decisions/DEC-20260901-974AB018.json"
      },
      {
        "code": "??",
        "path": ".ahp/records/qa/QA-20260901-A77312D5.json"
      },
      {
        "code": "??",
        "path": ".ahp/records/requirements/REQ-20260901-8A668347.json"
      }
    ],
    "upstream": null,
    "ahead": null,
    "behind": null
  },
  "created_at": "2026-09-01T16:55:47.213Z",
  "integrity": {
    "algorithm": "sha256",
    "canonicalization": "ahp-canonical-json-v1",
    "digest": "4c7b149f741909813e64cfae41807ae7d23cdefd3f5bee29ce5ecf8f034dce13"
  }
}
