{
  "schema_version": "1.1.0",
  "id": "CHK-20260812-441EEC73",
  "kind": "checkpoint",
  "session_id": "codex-ahp-public-release",
  "project_id": "ahp-plus",
  "summary": "Compatibilidad Windows corregida y gate local completo aprobado",
  "objective": "Entregar AHP+ como protocolo y CLI interplataforma instalable por proyecto",
  "next_action": "Publicar compatibilidad Windows y confirmar las seis combinaciones de GitHub Actions",
  "files": [
    "package.json",
    "scripts/validate.mjs",
    ".github/workflows/validate.yml",
    "CHANGELOG.md"
  ],
  "validations": [
    "QA-20260812-2FE0E94E"
  ],
  "blockers": [],
  "actor": {
    "name": "Codex",
    "platform": "codex",
    "model": "GPT-5"
  },
  "git": {
    "branch": "main",
    "commit": "53cc6810abb76e36906697a092f4041e878f607b",
    "tree": "c3235e18e3f6b20903c8519f88ccd085e8293723",
    "working_tree": "DIRTY",
    "changed_files": [
      {
        "code": " M",
        "path": ".ahp/INDEX.md"
      },
      {
        "code": " M",
        "path": ".ahp/state/project.json"
      },
      {
        "code": "??",
        "path": ".ahp/evidence/EVD-20260812-133E4E8A.json"
      },
      {
        "code": "??",
        "path": ".ahp/evidence/EVD-20260812-88F27795.json"
      },
      {
        "code": "??",
        "path": ".ahp/records/qa/QA-20260812-2FE0E94E.json"
      }
    ],
    "working_tree_digest": "3a5465119f952768247bebd0af7b8a04b35cdba0cd59c949ff065bc81e74b8f2",
    "project_working_tree": "CLEAN",
    "project_changed_files": [],
    "project_working_tree_digest": "e3b0c44298fc1c149afbf4c8996fb92427ae41e4649b934ca495991b7852b855",
    "ahp_state_working_tree": "DIRTY",
    "ahp_state_changed_files": [
      {
        "code": " M",
        "path": ".ahp/INDEX.md"
      },
      {
        "code": " M",
        "path": ".ahp/state/project.json"
      },
      {
        "code": "??",
        "path": ".ahp/evidence/EVD-20260812-133E4E8A.json"
      },
      {
        "code": "??",
        "path": ".ahp/evidence/EVD-20260812-88F27795.json"
      },
      {
        "code": "??",
        "path": ".ahp/records/qa/QA-20260812-2FE0E94E.json"
      }
    ],
    "upstream": "origin/main",
    "ahead": 1,
    "behind": 0
  },
  "created_at": "2026-08-12T23:25:26.581Z",
  "integrity": {
    "algorithm": "sha256",
    "canonicalization": "ahp-canonical-json-v1",
    "digest": "42e8c811ee4da26a1ca0a3baf6d36546bd686b8e4b0dd51bd49ab3f9b6f57874"
  }
}
