{
  "schema_version": "1.1.0",
  "id": "CHK-20260812-63E8E8AF",
  "kind": "checkpoint",
  "session_id": "codex-ahp-public-release",
  "project_id": "ahp-plus",
  "summary": "Causa de CI corregida y regresión local superada",
  "objective": "Entregar AHP+ como protocolo y CLI interplataforma instalable por proyecto",
  "next_action": "Publicar el fix de checkout completo y confirmar la matriz GitHub Actions",
  "files": [
    ".github/workflows/validate.yml",
    "src/git.mjs",
    "src/validation.mjs",
    "tests/core.test.mjs",
    "CHANGELOG.md"
  ],
  "validations": [
    "QA-20260812-46EC6F6A"
  ],
  "blockers": [],
  "actor": {
    "name": "Codex",
    "platform": "codex",
    "model": "GPT-5"
  },
  "git": {
    "branch": "main",
    "commit": "668b624ca45bb42894acca4d534f4ffb82bc077a",
    "tree": "6b8193b854eff006a0a6e8726610640d23d0eb9a",
    "working_tree": "DIRTY",
    "changed_files": [
      {
        "code": " M",
        "path": ".ahp/INDEX.md"
      },
      {
        "code": " M",
        "path": ".ahp/state/project.json"
      },
      {
        "code": "??",
        "path": ".ahp/evidence/EVD-20260812-7DAFF86E.json"
      },
      {
        "code": "??",
        "path": ".ahp/evidence/EVD-20260812-F29ACE58.json"
      },
      {
        "code": "??",
        "path": ".ahp/records/qa/QA-20260812-46EC6F6A.json"
      }
    ],
    "working_tree_digest": "be4c4302cee836e2a67d3172fd56bca2b9403504d22b1929d200393785e6e264",
    "project_working_tree": "CLEAN",
    "project_changed_files": [],
    "project_working_tree_digest": "e3b0c44298fc1c149afbf4c8996fb92427ae41e4649b934ca495991b7852b855",
    "ahp_state_working_tree": "DIRTY",
    "ahp_state_changed_files": [
      {
        "code": " M",
        "path": ".ahp/INDEX.md"
      },
      {
        "code": " M",
        "path": ".ahp/state/project.json"
      },
      {
        "code": "??",
        "path": ".ahp/evidence/EVD-20260812-7DAFF86E.json"
      },
      {
        "code": "??",
        "path": ".ahp/evidence/EVD-20260812-F29ACE58.json"
      },
      {
        "code": "??",
        "path": ".ahp/records/qa/QA-20260812-46EC6F6A.json"
      }
    ],
    "upstream": "origin/main",
    "ahead": 1,
    "behind": 0
  },
  "created_at": "2026-08-12T23:23:14.129Z",
  "integrity": {
    "algorithm": "sha256",
    "canonicalization": "ahp-canonical-json-v1",
    "digest": "aa94f13c426864b39bde1352addfe3a9941c959b09868aa4ddd71af9a44c5367"
  }
}
