{
  "schema_version": "1.1.0",
  "id": "CHK-20260812-150D5053",
  "kind": "checkpoint",
  "session_id": "codex-ahp-public-release",
  "project_id": "ahp-plus",
  "summary": "Rutas Git de Windows normalizadas y gate local aprobado",
  "objective": "Entregar AHP+ como protocolo y CLI interplataforma instalable por proyecto",
  "next_action": "Confirmar la matriz GitHub Actions después de normalizar las rutas Git de Windows",
  "files": [
    "src/git.mjs",
    "tests/helpers.mjs",
    "CHANGELOG.md"
  ],
  "validations": [
    "QA-20260812-2906F954"
  ],
  "blockers": [],
  "actor": {
    "name": "Codex",
    "platform": "codex",
    "model": "GPT-5"
  },
  "git": {
    "branch": "main",
    "commit": "fd668c8211edf09f5c0f2abaa6294d102bef85c0",
    "tree": "af42aebb934b4b56264de0463071b57188189501",
    "working_tree": "DIRTY",
    "changed_files": [
      {
        "code": " M",
        "path": ".ahp/INDEX.md"
      },
      {
        "code": " M",
        "path": ".ahp/state/project.json"
      },
      {
        "code": "??",
        "path": ".ahp/evidence/EVD-20260812-43499C08.json"
      },
      {
        "code": "??",
        "path": ".ahp/evidence/EVD-20260812-49107838.json"
      },
      {
        "code": "??",
        "path": ".ahp/records/qa/QA-20260812-2906F954.json"
      }
    ],
    "working_tree_digest": "5a8262c65534f6063b47b1d654bb403d83ff756e8836688c12437e0e3b80a3e1",
    "project_working_tree": "CLEAN",
    "project_changed_files": [],
    "project_working_tree_digest": "e3b0c44298fc1c149afbf4c8996fb92427ae41e4649b934ca495991b7852b855",
    "ahp_state_working_tree": "DIRTY",
    "ahp_state_changed_files": [
      {
        "code": " M",
        "path": ".ahp/INDEX.md"
      },
      {
        "code": " M",
        "path": ".ahp/state/project.json"
      },
      {
        "code": "??",
        "path": ".ahp/evidence/EVD-20260812-43499C08.json"
      },
      {
        "code": "??",
        "path": ".ahp/evidence/EVD-20260812-49107838.json"
      },
      {
        "code": "??",
        "path": ".ahp/records/qa/QA-20260812-2906F954.json"
      }
    ],
    "upstream": "origin/main",
    "ahead": 1,
    "behind": 0
  },
  "created_at": "2026-08-12T23:27:37.270Z",
  "integrity": {
    "algorithm": "sha256",
    "canonicalization": "ahp-canonical-json-v1",
    "digest": "fab8a291402b09c49493c3de06221cfda444cf68230804dc2860ef80c680b0c9"
  }
}
