{
  "schema_version": "1.1.0",
  "id": "CHK-20260812-B14EA877",
  "kind": "checkpoint",
  "session_id": "codex-ahp-public-release",
  "project_id": "ahp-plus",
  "summary": "AHP+ 1.1.0-emancipation.0 publicado y verificado desde su tag GitHub",
  "objective": "Entregar AHP+ como protocolo y CLI interplataforma instalable por proyecto",
  "next_action": "Instalar AHP+ en el primer proyecto externo y ejecutar ahp adapter install all --apply",
  "files": [
    "README.md",
    "SPECIFICATION.md",
    "docs/COMMANDS.md",
    "docs/MOBILE_AND_REMOTE.md"
  ],
  "validations": [
    "QA-20260812-A8BCAAFD"
  ],
  "blockers": [],
  "actor": {
    "name": "Codex",
    "platform": "codex",
    "model": "GPT-5"
  },
  "git": {
    "branch": "main",
    "commit": "b00b25cb06a802c7b347a0effbb9c97134760442",
    "tree": "29c4d344e3f61c7d9172f6707feb843f3ef0a827",
    "working_tree": "DIRTY",
    "changed_files": [
      {
        "code": " M",
        "path": ".ahp/INDEX.md"
      },
      {
        "code": " M",
        "path": ".ahp/state/project.json"
      },
      {
        "code": "??",
        "path": ".ahp/evidence/EVD-20260812-24693F72.json"
      },
      {
        "code": "??",
        "path": ".ahp/evidence/EVD-20260812-BE1BA620.json"
      },
      {
        "code": "??",
        "path": ".ahp/records/qa/QA-20260812-A8BCAAFD.json"
      }
    ],
    "working_tree_digest": "98f088b312adcab488d616271559bdfb46c9470957d2d1ef2d6d375e2d98165d",
    "project_working_tree": "CLEAN",
    "project_changed_files": [],
    "project_working_tree_digest": "e3b0c44298fc1c149afbf4c8996fb92427ae41e4649b934ca495991b7852b855",
    "ahp_state_working_tree": "DIRTY",
    "ahp_state_changed_files": [
      {
        "code": " M",
        "path": ".ahp/INDEX.md"
      },
      {
        "code": " M",
        "path": ".ahp/state/project.json"
      },
      {
        "code": "??",
        "path": ".ahp/evidence/EVD-20260812-24693F72.json"
      },
      {
        "code": "??",
        "path": ".ahp/evidence/EVD-20260812-BE1BA620.json"
      },
      {
        "code": "??",
        "path": ".ahp/records/qa/QA-20260812-A8BCAAFD.json"
      }
    ],
    "upstream": "origin/main",
    "ahead": 0,
    "behind": 0
  },
  "created_at": "2026-08-12T23:20:31.890Z",
  "integrity": {
    "algorithm": "sha256",
    "canonicalization": "ahp-canonical-json-v1",
    "digest": "b474f2a451b1f880a12d4c7b75b664529191bf0524a10f0e390b10343cedc73a"
  }
}
